제목,기자,내용,날짜
"""점심은 티라미수 한조각"" 98세 서울대 前총장 '장수 비밀'",중앙일보,"성큼 다가온 백세시대, 이제는 천천히 건강하게 늙는 사람이 성공한 자입니다. 100세 인생을 살고 있는 근사한 어르신들을 직접 만나 그 비법을 전수받았습니다. ‘저속노화 비밀’이 궁금하시다면? 중앙일보의 프리미엄 유료 콘텐트 ‘ 더중앙플러스-헬스+100세의 행복(htt...",2026-04-28 09:59
"챗GPT, 도쿄대 입학시험 '수석합격' 일냈다…2년전에는 탈락했는데",헤럴드경제,일본 도쿄의 한 건물 [123RF] [헤럴드경제=이원율 기자]오픈AI의 챗GPT가 올 초 치러진 일본 도쿄대와 교토대의 입학시험 문제를 풀게 한 결과 수석 합격에 필적하는 점수를 냈다고 교도통신이 27일 전했다. GPT-5.2가 올해 도쿄대 입학시험(만점 550점)에서...,2026-04-28 15:46
포토샵도 못하는데…북유럽 에스테틱 화장품 광고 30분 만에 만든 비결,아시아경제,"""북유럽 에스테틱 화장품 브랜드를 광고하는 영상을 만들 거야. 영화 '미드소마'에 나올법한 꽃장식과 흰 원피스를 입은 소녀가 나오는 모습을 생성해줘."" 기자가 오픈AI GPT 이미지 2.0과 바이트댄스 시댄스 2.0을 활용해 만든 가상의 화장품 광고 영상 캡처. 이은서...",2026-04-28 07:44
"""더는 못 하겠다"" 일일이 씻고 말려도 '헛수고'…결국, 포기하는 한국인들 [지구, 뭐래?]",헤럴드경제,"종이팩이 분리배출된 모습. 김광우 기자. [헤럴드경제=김광우 기자] “진짜 도움이 되긴 하는 거야?” 스스로 ‘재활용의 민족’이라고 자칭하는 한국인들. 쓰레기 분리 체계가 비교적 복잡한 데도, 분리배출 참여가 높은 수준을 유지하기 때문이다. 실제 일반 가정에서 배달음식...",2026-04-27 17:41
"[속보] 법원, 넷플릭스 법인세 부과 취소…""조세회피 인정 어렵다""",아이뉴스24,"[아이뉴스24 서효빈 기자] 속보 [사진=아이뉴스24 DB] /서효빈 기자( x40805@inews24.com) [관련기사] ▶ [단독] 삼성전자 주주들, 이재용 자택 앞서 '맞불 집회' 신고 ▶ [노사 상생] ①""하루 1조씩 피해""…삼성전자 최악의 파업 위기 ▶ ""저...",2026-04-28 11:25
